No.;Time;Source;Destination;Protocol;Length;Info;;;;;;;;;;;;;;;
1;0.000000;23.7.217.88;192.168.43.47;TCP;54;443  >  49718 [ACK] Seq=1 Ack=1 Win=245 Len=0;;;;;;;;;;;;;;;
3;0.137533;23.7.217.88;192.168.43.47;TLSv1.2;319;Application Data;;;;;;;;;;;Kolom1;Kolom2;Kolom3;Kolom4;Kolom5
4;0.142411;192.168.43.47;23.7.217.88;TCP;54;49718  >  443 [FIN, ACK] Seq=1 Ack=266 Win=253 Len=0;;;;;;;;;;;time 2;time 1;delay 1;delay 2;jiter
7;0.176440;192.168.43.47;23.7.217.88;TCP;66;49720  >  443 [SYN] Seq=0 Win=64240 Len=0 MSS=1460 WS=256 SACK_PERM=1;;;;;;;;;;;0,137533;0;0,137533;0,004878;0,132655
8;0.236247;23.7.217.88;192.168.43.47;TCP;54;[TCP Previous segment not captured] 443  >  49718 [FIN, ACK] Seq=297 Ack=2 Win=245 Len=0;;;;;;;;;;;0,142411;0,137533;0,004878;0,034029;0,029151
9;0.236410;192.168.43.47;23.7.217.88;TCP;54;[TCP Dup ACK 4#1] 49718  >  443 [ACK] Seq=2 Ack=266 Win=253 Len=0;;;;;;;;;;;0,17644;0,142411;0,034029;0,059807;0,025778
10;0.236719;23.7.217.88;192.168.43.47;TCP;85;[TCP Out-Of-Order] 443  >  49718 [PSH, ACK] Seq=266 Ack=2 Win=245 Len=31;;;;;;;;;;;0,236247;0,17644;0,059807;0,000163;0,059644
11;0.236795;192.168.43.47;23.7.217.88;TCP;54;49718  >  443 [RST, ACK] Seq=2 Ack=297 Win=0 Len=0;;;;;;;;;;;0,23641;0,236247;0,000163;0,000309;0,000146
12;0.276411;23.7.217.88;192.168.43.47;TCP;66;443  >  49720 [SYN, ACK] Seq=0 Ack=1 Win=29200 Len=0 MSS=1400 SACK_PERM=1 WS=128;;;;;;;;;;;0,236719;0,23641;0,000309;7,6E-05;0,000233
13;0.276663;192.168.43.47;23.7.217.88;TCP;54;49720  >  443 [ACK] Seq=1 Ack=1 Win=65792 Len=0;;;;;;;;;;;0,236795;0,236719;7,6E-05;0,039616;0,03954
14;0.279010;192.168.43.47;23.7.217.88;TLSv1.2;271;Client Hello;;;;;;;;;;;0,276411;0,236795;0,039616;0,000252;0,039364
15;0.328256;147.135.46.101;192.168.43.47;TCP;54;80  >  49717 [ACK] Seq=1 Ack=1 Win=26800 Len=0;;;;;;;;;;;0,276663;0,276411;0,000252;0,002347;0,002095
16;0.332576;147.135.46.101;192.168.43.47;HTTP;204;HTTP/1.1 200 OK  (text/html);;;;;;;;;;;0,27901;0,276663;0,002347;0,049246;0,046899
17;0.332737;192.168.43.47;147.135.46.101;TCP;54;49717  >  80 [ACK] Seq=1 Ack=151 Win=65535 Len=0;;;;;;;;;;;0,328256;0,27901;0,049246;0,00432;0,044926
18;0.378479;23.7.217.88;192.168.43.47;TCP;54;443  >  49720 [ACK] Seq=1 Ack=218 Win=30336 Len=0;;;;;;;;;;;0,332576;0,328256;0,00432;0,000161;0,004159
19;0.378798;23.7.217.88;192.168.43.47;TLSv1.2;1454;Server Hello;;;;;;;;;;;0,332737;0,332576;0,000161;0,045742;0,045581
20;0.379218;23.7.217.88;192.168.43.47;TCP;1454;443  >  49720 [ACK] Seq=1401 Ack=218 Win=30336 Len=1400 [TCP segment of a reassembled PDU];;;;;;;;;;;0,378479;0,332737;0,045742;0,000319;0,045423
21;0.379316;192.168.43.47;23.7.217.88;TCP;54;49720  >  443 [ACK] Seq=218 Ack=2801 Win=65792 Len=0;;;;;;;;;;;0,378798;0,378479;0,000319;0,00042;0,000101
22;0.379928;23.7.217.88;192.168.43.47;TLSv1.2;1350;Certificate [TCP segment of a reassembled PDU];;;;;;;;;;;0,379218;0,378798;0,00042;9,8E-05;0,000322
23;0.379928;23.7.217.88;192.168.43.47;TLSv1.2;1454;Certificate Status [TCP segment of a reassembled PDU];;;;;;;;;;;0,379316;0,379218;9,8E-05;0,000612;0,000514
24;0.380173;192.168.43.47;23.7.217.88;TCP;54;49720  >  443 [ACK] Seq=218 Ack=5497 Win=65792 Len=0;;;;;;;;;;;0,379928;0,379316;0,000612;;
25;0.469750;23.7.217.88;192.168.43.47;TLSv1.2;336;Server Key Exchange, Server Hello Done;;;;;;;;;;;;total delay;0,379928;total jiter;0,516531
26;0.476799;192.168.43.47;23.7.217.88;TLSv1.2;180;Client Key Exchange, Change Cipher Spec, Encrypted Handshake Message;;;;;;;;;;;;rata - rata delay;3,96875E-05;rata-rata jiter;5,39571E-05
27;0.564157;23.7.217.88;192.168.43.47;TLSv1.2;328;New Session Ticket, Change Cipher Spec, Encrypted Handshake Message;;;;;;;;;;;;;;;
28;0.566719;192.168.43.47;23.7.217.88;TLSv1.2;587;Application Data;;;;;;;;;;;;;;;
29;0.724388;23.7.217.88;192.168.43.47;TCP;54;443  >  49720 [ACK] Seq=6053 Ack=877 Win=31360 Len=0;;;;;;;;;;;;;;;
30;0.832245;23.7.217.88;192.168.43.47;TLSv1.2;749;Application Data;;;;;;;;;;;;;;;
31;0.835604;192.168.43.47;23.7.217.88;TCP;54;49720  >  443 [FIN, ACK] Seq=877 Ack=6748 Win=64512 Len=0;;;;;;;;;;;;;;;
34;0.907962;192.168.43.47;23.7.217.88;TCP;66;49721  >  443 [SYN] Seq=0 Win=64240 Len=0 MSS=1460 WS=256 SACK_PERM=1;;;;;;;;;;;;;;;
35;0.928107;23.7.217.88;192.168.43.47;TLSv1.2;85;Encrypted Alert;;;;;;;;;;;;;;;
36;0.928275;192.168.43.47;23.7.217.88;TCP;54;49720  >  443 [RST, ACK] Seq=878 Ack=6779 Win=0 Len=0;;;;;;;;;;;;;;;
37;0.928580;23.7.217.88;192.168.43.47;TCP;54;443  >  49720 [FIN, ACK] Seq=6779 Ack=878 Win=31360 Len=0;;;;;;;;;;;;;;;
38;0.988366;23.7.217.88;192.168.43.47;TCP;66;443  >  49721 [SYN, ACK] Seq=0 Ack=1 Win=29200 Len=0 MSS=1400 SACK_PERM=1 WS=128;;;;;;;;;;;;;;;
39;0.988595;192.168.43.47;23.7.217.88;TCP;54;49721  >  443 [ACK] Seq=1 Ack=1 Win=65792 Len=0;;;;;;;;;;;;;;;
40;0.989660;192.168.43.47;23.7.217.88;TLSv1.2;271;Client Hello;;;;;;;;;;;;;;;
41;1.084.599;23.7.217.88;192.168.43.47;TCP;54;443  >  49721 [ACK] Seq=1 Ack=218 Win=30336 Len=0;;;;;;;;;;;;;;;
42;1.084.599;23.7.217.88;192.168.43.47;TLSv1.2;1454;Server Hello;;;;;;;;;;;;;;;
43;1.084.599;23.7.217.88;192.168.43.47;TCP;1350;[TCP Previous segment not captured] 443  >  49721 [PSH, ACK] Seq=2801 Ack=218 Win=30336 Len=1296 [TCP segment of a reassembled PDU] [TCP segment of a reassembled PDU];;;;;;;;;;;;;;;
44;1.084.797;192.168.43.47;23.7.217.88;TCP;66;49721  >  443 [ACK] Seq=218 Ack=1401 Win=65792 Len=0 SLE=2801 SRE=4097;;;;;;;;;;;;;;;
45;1.085.130;23.7.217.88;192.168.43.47;TCP;1454;[TCP Out-Of-Order] 443  >  49721 [ACK] Seq=1401 Ack=218 Win=30336 Len=1400;;;;;;;;;;;;;;;
46;1.085.130;23.7.217.88;192.168.43.47;TLSv1.2;1454;Certificate Status [TCP segment of a reassembled PDU];;;;;;;;;;;;;;;
47;1.085.230;192.168.43.47;23.7.217.88;TCP;54;49721  >  443 [ACK] Seq=218 Ack=4097 Win=65792 Len=0;;;;;;;;;;;;;;;
48;1.085.325;192.168.43.47;23.7.217.88;TCP;54;49721  >  443 [ACK] Seq=218 Ack=5497 Win=65792 Len=0;;;;;;;;;;;;;;;
49;1.167.300;23.7.217.88;192.168.43.47;TLSv1.2;336;Server Key Exchange, Server Hello Done;;;;;;;;;;;;;;;
50;1.174.298;192.168.43.47;23.7.217.88;TLSv1.2;180;Client Key Exchange, Change Cipher Spec, Encrypted Handshake Message;;;;;;;;;;;;;;;
51;1.255.466;23.7.217.88;192.168.43.47;TLSv1.2;328;New Session Ticket, Change Cipher Spec, Encrypted Handshake Message;;;;;;;;;;;;;;;
52;1.257.914;192.168.43.47;23.7.217.88;TLSv1.2;587;Application Data;;;;;;;;;;;;;;;
53;1.345.276;23.7.217.88;192.168.43.47;TLSv1.2;747;Application Data;;;;;;;;;;;;;;;
54;1.349.174;192.168.43.47;23.7.217.88;TCP;54;49721  >  443 [FIN, ACK] Seq=877 Ack=6746 Win=64512 Len=0;;;;;;;;;;;;;;;
56;1.427.679;23.7.217.88;192.168.43.47;TCP;54;[TCP Previous segment not captured] 443  >  49721 [FIN, ACK] Seq=6777 Ack=878 Win=31360 Len=0;;;;;;;;;;;;;;;
57;1.427.869;192.168.43.47;23.7.217.88;TCP;54;[TCP Dup ACK 54#1] 49721  >  443 [ACK] Seq=878 Ack=6746 Win=64512 Len=0;;;;;;;;;;;;;;;
58;1.428.175;23.7.217.88;192.168.43.47;TCP;85;[TCP Out-Of-Order] 443  >  49721 [PSH, ACK] Seq=6746 Ack=878 Win=31360 Len=31;;;;;;;;;;;;;;;
59;1.428.253;192.168.43.47;23.7.217.88;TCP;54;49721  >  443 [RST, ACK] Seq=878 Ack=6777 Win=0 Len=0;;;;;;;;;;;;;;;
61;1.448.812;192.168.43.47;23.7.217.88;TCP;66;49724  >  443 [SYN] Seq=0 Win=64240 Len=0 MSS=1460 WS=256 SACK_PERM=1;;;;;;;;;;;;;;;
62;1.523.683;23.7.217.88;192.168.43.47;TCP;66;443  >  49724 [SYN, ACK] Seq=0 Ack=1 Win=29200 Len=0 MSS=1400 SACK_PERM=1 WS=128;;;;;;;;;;;;;;;
63;1.523.909;192.168.43.47;23.7.217.88;TCP;54;49724  >  443 [ACK] Seq=1 Ack=1 Win=65792 Len=0;;;;;;;;;;;;;;;
64;1.524.968;192.168.43.47;23.7.217.88;TLSv1.2;271;Client Hello;;;;;;;;;;;;;;;
65;1.612.314;23.7.217.88;192.168.43.47;TCP;54;443  >  49724 [ACK] Seq=1 Ack=218 Win=30336 Len=0;;;;;;;;;;;;;;;
66;1.613.234;23.7.217.88;192.168.43.47;TCP;1454;[TCP Previous segment not captured] 443  >  49724 [ACK] Seq=1401 Ack=218 Win=30336 Len=1400 [TCP segment of a reassembled PDU];;;;;;;;;;;;;;;
67;1.613.342;192.168.43.47;23.7.217.88;TCP;66;[TCP Dup ACK 63#1] 49724  >  443 [ACK] Seq=218 Ack=1 Win=65792 Len=0 SLE=1401 SRE=2801;;;;;;;;;;;;;;;
68;1.613.654;23.7.217.88;192.168.43.47;TCP;1350;443  >  49724 [PSH, ACK] Seq=2801 Ack=218 Win=30336 Len=1296 [TCP segment of a reassembled PDU] [TCP segment of a reassembled PDU];;;;;;;;;;;;;;;
69;1.613.721;192.168.43.47;23.7.217.88;TCP;66;[TCP Dup ACK 63#2] 49724  >  443 [ACK] Seq=218 Ack=1 Win=65792 Len=0 SLE=1401 SRE=4097;;;;;;;;;;;;;;;
70;1.614.080;23.7.217.88;192.168.43.47;TLSv1.2;1454;[TCP Fast Retransmission] , Server Hello;;;;;;;;;;;;;;;
71;1.614.177;192.168.43.47;23.7.217.88;TCP;54;49724  >  443 [ACK] Seq=218 Ack=4097 Win=65792 Len=0;;;;;;;;;;;;;;;
72;1.631.785;23.7.217.88;192.168.43.47;TLSv1.2;1454;Ignored Unknown Record;;;;;;;;;;;;;;;
73;1.674.931;192.168.43.47;23.7.217.88;TCP;54;49724  >  443 [ACK] Seq=218 Ack=5497 Win=65792 Len=0;;;;;;;;;;;;;;;
74;1.686.315;23.7.217.88;192.168.43.47;TLSv1.2;336;Ignored Unknown Record;;;;;;;;;;;;;;;
75;1.693.386;192.168.43.47;23.7.217.88;TLSv1.2;180;Client Key Exchange, Change Cipher Spec, Encrypted Handshake Message;;;;;;;;;;;;;;;
76;1.784.327;23.7.217.88;192.168.43.47;TLSv1.2;328;New Session Ticket, Change Cipher Spec, Encrypted Handshake Message;;;;;;;;;;;;;;;
77;1.786.871;192.168.43.47;23.7.217.88;TLSv1.2;584;Application Data;;;;;;;;;;;;;;;
78;1.892.599;23.7.217.88;192.168.43.47;TLSv1.2;726;Application Data;;;;;;;;;;;;;;;
79;1.895.381;192.168.43.47;23.7.217.88;TCP;54;49724  >  443 [FIN, ACK] Seq=874 Ack=6725 Win=64512 Len=0;;;;;;;;;;;;;;;
80;1.963.531;23.7.217.88;192.168.43.47;TCP;54;[TCP Previous segment not captured] 443  >  49724 [FIN, ACK] Seq=6756 Ack=875 Win=31360 Len=0;;;;;;;;;;;;;;;
81;1.963.679;192.168.43.47;23.7.217.88;TCP;54;[TCP Dup ACK 79#1] 49724  >  443 [ACK] Seq=875 Ack=6725 Win=64512 Len=0;;;;;;;;;;;;;;;
82;1.963.998;23.7.217.88;192.168.43.47;TCP;85;[TCP Out-Of-Order] 443  >  49724 [PSH, ACK] Seq=6725 Ack=875 Win=31360 Len=31;;;;;;;;;;;;;;;
83;1.964.083;192.168.43.47;23.7.217.88;TCP;54;49724  >  443 [RST, ACK] Seq=875 Ack=6756 Win=0 Len=0;;;;;;;;;;;;;;;
86;1.981.876;192.168.43.47;23.7.217.88;TCP;66;49725  >  443 [SYN] Seq=0 Win=64240 Len=0 MSS=1460 WS=256 SACK_PERM=1;;;;;;;;;;;;;;;
87;2.073.362;23.7.217.88;192.168.43.47;TCP;66;443  >  49725 [SYN, ACK] Seq=0 Ack=1 Win=29200 Len=0 MSS=1400 SACK_PERM=1 WS=128;;;;;;;;;;;;;;;
88;2.073.581;192.168.43.47;23.7.217.88;TCP;54;49725  >  443 [ACK] Seq=1 Ack=1 Win=65792 Len=0;;;;;;;;;;;;;;;
89;2.074.662;192.168.43.47;23.7.217.88;TLSv1.2;271;Client Hello;;;;;;;;;;;;;;;
90;2.151.548;23.7.217.88;192.168.43.47;TCP;54;443  >  49725 [ACK] Seq=1 Ack=218 Win=30336 Len=0;;;;;;;;;;;;;;;
91;2.152.499;23.7.217.88;192.168.43.47;TLSv1.2;1454;Server Hello;;;;;;;;;;;;;;;
92;2.153.038;23.7.217.88;192.168.43.47;TCP;1454;443  >  49725 [ACK] Seq=1401 Ack=218 Win=30336 Len=1400 [TCP segment of a reassembled PDU];;;;;;;;;;;;;;;
93;2.153.038;23.7.217.88;192.168.43.47;TLSv1.2;1350;Certificate [TCP segment of a reassembled PDU];;;;;;;;;;;;;;;
94;2.153.159;192.168.43.47;23.7.217.88;TCP;54;49725  >  443 [ACK] Seq=218 Ack=4097 Win=65792 Len=0;;;;;;;;;;;;;;;
95;2.162.664;23.7.217.88;192.168.43.47;TLSv1.2;1454;Certificate Status [TCP segment of a reassembled PDU];;;;;;;;;;;;;;;
96;2.162.825;192.168.43.47;23.7.217.88;TCP;54;49725  >  443 [ACK] Seq=218 Ack=5497 Win=65792 Len=0;;;;;;;;;;;;;;;
97;2.231.615;23.7.217.88;192.168.43.47;TLSv1.2;336;Server Key Exchange, Server Hello Done;;;;;;;;;;;;;;;
98;2.238.774;192.168.43.47;23.7.217.88;TLSv1.2;180;Client Key Exchange, Change Cipher Spec, Encrypted Handshake Message;;;;;;;;;;;;;;;
99;2.323.196;23.7.217.88;192.168.43.47;TLSv1.2;328;New Session Ticket, Change Cipher Spec, Encrypted Handshake Message;;;;;;;;;;;;;;;
100;2.325.749;192.168.43.47;23.7.217.88;TLSv1.2;587;Application Data;;;;;;;;;;;;;;;
101;2.421.587;23.7.217.88;192.168.43.47;TLSv1.2;742;Application Data;;;;;;;;;;;;;;;
102;2.424.914;192.168.43.47;23.7.217.88;TCP;54;49725  >  443 [FIN, ACK] Seq=877 Ack=6741 Win=64512 Len=0;;;;;;;;;;;;;;;
105;2.497.593;192.168.43.47;23.7.217.88;TCP;66;49726  >  443 [SYN] Seq=0 Win=64240 Len=0 MSS=1460 WS=256 SACK_PERM=1;;;;;;;;;;;;;;;
106;2.504.117;23.7.217.88;192.168.43.47;TLSv1.2;85;Encrypted Alert;;;;;;;;;;;;;;;
107;2.504.283;192.168.43.47;23.7.217.88;TCP;54;49725  >  443 [RST, ACK] Seq=878 Ack=6772 Win=0 Len=0;;;;;;;;;;;;;;;
108;2.504.580;23.7.217.88;192.168.43.47;TCP;54;443  >  49725 [FIN, ACK] Seq=6772 Ack=878 Win=31360 Len=0;;;;;;;;;;;;;;;
109;2.584.613;23.7.217.88;192.168.43.47;TCP;66;443  >  49726 [SYN, ACK] Seq=0 Ack=1 Win=29200 Len=0 MSS=1400 SACK_PERM=1 WS=128;;;;;;;;;;;;;;;
110;2.584.847;192.168.43.47;23.7.217.88;TCP;54;49726  >  443 [ACK] Seq=1 Ack=1 Win=65792 Len=0;;;;;;;;;;;;;;;
111;2.585.870;192.168.43.47;23.7.217.88;TLSv1.2;271;Client Hello;;;;;;;;;;;;;;;
112;2.665.320;23.7.217.88;192.168.43.47;TCP;54;443  >  49726 [ACK] Seq=1 Ack=218 Win=30336 Len=0;;;;;;;;;;;;;;;
113;2.665.968;23.7.217.88;192.168.43.47;TCP;1454;[TCP Previous segment not captured] 443  >  49726 [ACK] Seq=1401 Ack=218 Win=30336 Len=1400;;;;;;;;;;;;;;;
114;2.665.968;23.7.217.88;192.168.43.47;TLSv1.2;1350;Ignored Unknown Record;;;;;;;;;;;;;;;
115;2.665.968;23.7.217.88;192.168.43.47;TCP;1454;[TCP Out-Of-Order] 443  >  49726 [ACK] Seq=1 Ack=218 Win=30336 Len=1400;;;;;;;;;;;;;;;
116;2.666.091;192.168.43.47;23.7.217.88;TCP;66;[TCP Dup ACK 110#1] 49726  >  443 [ACK] Seq=218 Ack=1 Win=65792 Len=0 SLE=1401 SRE=2801;;;;;;;;;;;;;;;
117;2.666.269;192.168.43.47;23.7.217.88;TCP;66;[TCP Dup ACK 110#2] 49726  >  443 [ACK] Seq=218 Ack=1 Win=65792 Len=0 SLE=1401 SRE=4097;;;;;;;;;;;;;;;
118;2.666.393;192.168.43.47;23.7.217.88;TCP;54;49726  >  443 [ACK] Seq=218 Ack=4097 Win=65792 Len=0;;;;;;;;;;;;;;;
119;2.666.608;23.7.217.88;192.168.43.47;TLSv1.2;1454;Ignored Unknown Record;;;;;;;;;;;;;;;
120;2.706.902;192.168.43.47;23.7.217.88;TCP;54;49726  >  443 [ACK] Seq=218 Ack=5497 Win=65792 Len=0;;;;;;;;;;;;;;;
121;2.758.251;23.7.217.88;192.168.43.47;TLSv1.2;336;Ignored Unknown Record;;;;;;;;;;;;;;;
122;2.765.246;192.168.43.47;23.7.217.88;TLSv1.2;180;Client Key Exchange, Change Cipher Spec, Encrypted Handshake Message;;;;;;;;;;;;;;;
123;2.860.537;23.7.217.88;192.168.43.47;TLSv1.2;328;New Session Ticket, Change Cipher Spec, Encrypted Handshake Message;;;;;;;;;;;;;;;
124;2.863.034;192.168.43.47;23.7.217.88;TLSv1.2;587;Application Data;;;;;;;;;;;;;;;
125;2.992.149;23.7.217.88;192.168.43.47;TCP;54;443  >  49726 [ACK] Seq=6053 Ack=877 Win=31360 Len=0;;;;;;;;;;;;;;;
126;3.098.567;23.7.217.88;192.168.43.47;TLSv1.2;742;Application Data;;;;;;;;;;;;;;;
127;3.113.064;192.168.43.47;23.7.217.88;TCP;54;49726  >  443 [FIN, ACK] Seq=877 Ack=6741 Win=64512 Len=0;;;;;;;;;;;;;;;
130;3.168.157;192.168.43.47;23.7.217.88;TCP;66;49727  >  443 [SYN] Seq=0 Win=64240 Len=0 MSS=1460 WS=256 SACK_PERM=1;;;;;;;;;;;;;;;
131;3.193.081;23.7.217.88;192.168.43.47;TCP;54;[TCP Previous segment not captured] 443  >  49726 [FIN, ACK] Seq=6772 Ack=878 Win=31360 Len=0;;;;;;;;;;;;;;;
132;3.193.230;192.168.43.47;23.7.217.88;TCP;54;[TCP Dup ACK 127#1] 49726  >  443 [ACK] Seq=878 Ack=6741 Win=64512 Len=0;;;;;;;;;;;;;;;
133;3.193.529;23.7.217.88;192.168.43.47;TCP;85;[TCP Out-Of-Order] 443  >  49726 [PSH, ACK] Seq=6741 Ack=878 Win=31360 Len=31;;;;;;;;;;;;;;;
134;3.193.609;192.168.43.47;23.7.217.88;TCP;54;49726  >  443 [RST, ACK] Seq=878 Ack=6772 Win=0 Len=0;;;;;;;;;;;;;;;
135;3.252.367;23.7.217.88;192.168.43.47;TCP;66;443  >  49727 [SYN, ACK] Seq=0 Ack=1 Win=29200 Len=0 MSS=1400 SACK_PERM=1 WS=128;;;;;;;;;;;;;;;
136;3.252.588;192.168.43.47;23.7.217.88;TCP;54;49727  >  443 [ACK] Seq=1 Ack=1 Win=65792 Len=0;;;;;;;;;;;;;;;
137;3.254.085;192.168.43.47;23.7.217.88;TLSv1.2;271;Client Hello;;;;;;;;;;;;;;;
138;3.324.443;23.9.184.115;192.168.43.47;TCP;54;80  >  49682 [FIN, ACK] Seq=1 Ack=1 Win=245 Len=0;;;;;;;;;;;;;;;
139;3.324.611;192.168.43.47;23.9.184.115;TCP;54;49682  >  80 [ACK] Seq=1 Ack=2 Win=255 Len=0;;;;;;;;;;;;;;;
140;3.324.652;192.168.43.47;23.9.184.115;TCP;54;49682  >  80 [FIN, ACK] Seq=1 Ack=2 Win=255 Len=0;;;;;;;;;;;;;;;
141;3.333.200;23.7.217.88;192.168.43.47;TCP;54;443  >  49727 [ACK] Seq=1 Ack=218 Win=30336 Len=0;;;;;;;;;;;;;;;
142;3.333.635;23.7.217.88;192.168.43.47;TLSv1.2;1454;Server Hello;;;;;;;;;;;;;;;
143;3.333.635;23.7.217.88;192.168.43.47;TCP;1350;[TCP Previous segment not captured] 443  >  49727 [PSH, ACK] Seq=2801 Ack=218 Win=30336 Len=1296 [TCP segment of a reassembled PDU] [TCP segment of a reassembled PDU];;;;;;;;;;;;;;;
144;3.333.780;192.168.43.47;23.7.217.88;TCP;66;49727  >  443 [ACK] Seq=218 Ack=1401 Win=65792 Len=0 SLE=2801 SRE=4097;;;;;;;;;;;;;;;
145;3.334.258;23.7.217.88;192.168.43.47;TCP;1454;[TCP Out-Of-Order] 443  >  49727 [ACK] Seq=1401 Ack=218 Win=30336 Len=1400;;;;;;;;;;;;;;;
146;3.334.258;23.7.217.88;192.168.43.47;TLSv1.2;1454;Certificate Status [TCP segment of a reassembled PDU];;;;;;;;;;;;;;;
147;3.334.367;192.168.43.47;23.7.217.88;TCP;54;49727  >  443 [ACK] Seq=218 Ack=4097 Win=65792 Len=0;;;;;;;;;;;;;;;
148;3.334.470;192.168.43.47;23.7.217.88;TCP;54;49727  >  443 [ACK] Seq=218 Ack=5497 Win=65792 Len=0;;;;;;;;;;;;;;;
149;3.380.460;23.9.184.115;192.168.43.47;TCP;54;80  >  49682 [ACK] Seq=2 Ack=2 Win=245 Len=0;;;;;;;;;;;;;;;
150;3.403.468;23.7.217.88;192.168.43.47;TLSv1.2;336;Server Key Exchange, Server Hello Done;;;;;;;;;;;;;;;
151;3.414.394;192.168.43.47;23.7.217.88;TLSv1.2;180;Client Key Exchange, Change Cipher Spec, Encrypted Handshake Message;;;;;;;;;;;;;;;
152;3.504.763;23.7.217.88;192.168.43.47;TLSv1.2;328;New Session Ticket, Change Cipher Spec, Encrypted Handshake Message;;;;;;;;;;;;;;;
153;3.507.687;192.168.43.47;23.7.217.88;TLSv1.2;587;Application Data;;;;;;;;;;;;;;;
154;3.658.990;23.7.217.88;192.168.43.47;TCP;54;443  >  49727 [ACK] Seq=6053 Ack=877 Win=31360 Len=0;;;;;;;;;;;;;;;
155;3.780.747;23.7.217.88;192.168.43.47;TLSv1.2;728;Application Data;;;;;;;;;;;;;;;
156;3.784.019;192.168.43.47;23.7.217.88;TCP;54;49727  >  443 [FIN, ACK] Seq=877 Ack=6727 Win=64512 Len=0;;;;;;;;;;;;;;;
157;3.863.878;23.7.217.88;192.168.43.47;TCP;54;[TCP Previous segment not captured] 443  >  49727 [FIN, ACK] Seq=6758 Ack=878 Win=31360 Len=0;;;;;;;;;;;;;;;
158;3.864.015;192.168.43.47;23.7.217.88;TCP;54;[TCP Dup ACK 156#1] 49727  >  443 [ACK] Seq=878 Ack=6727 Win=64512 Len=0;;;;;;;;;;;;;;;
159;3.864.305;23.7.217.88;192.168.43.47;TCP;85;[TCP Out-Of-Order] 443  >  49727 [PSH, ACK] Seq=6727 Ack=878 Win=31360 Len=31;;;;;;;;;;;;;;;
160;3.864.378;192.168.43.47;23.7.217.88;TCP;54;49727  >  443 [RST, ACK] Seq=878 Ack=6758 Win=0 Len=0;;;;;;;;;;;;;;;
163;3.891.000;192.168.43.47;23.7.217.88;TCP;66;49728  >  443 [SYN] Seq=0 Win=64240 Len=0 MSS=1460 WS=256 SACK_PERM=1;;;;;;;;;;;;;;;
164;3.973.388;23.7.217.88;192.168.43.47;TCP;66;443  >  49728 [SYN, ACK] Seq=0 Ack=1 Win=29200 Len=0 MSS=1400 SACK_PERM=1 WS=128;;;;;;;;;;;;;;;
165;3.973.625;192.168.43.47;23.7.217.88;TCP;54;49728  >  443 [ACK] Seq=1 Ack=1 Win=65792 Len=0;;;;;;;;;;;;;;;
166;3.975.337;192.168.43.47;23.7.217.88;TLSv1.2;271;Client Hello;;;;;;;;;;;;;;;
167;4.054.572;23.7.217.88;192.168.43.47;TCP;54;443  >  49728 [ACK] Seq=1 Ack=218 Win=30336 Len=0;;;;;;;;;;;;;;;
168;4.054.572;23.7.217.88;192.168.43.47;TLSv1.2;1454;Server Hello;;;;;;;;;;;;;;;
169;4.054.572;23.7.217.88;192.168.43.47;TCP;1350;[TCP Previous segment not captured] 443  >  49728 [PSH, ACK] Seq=2801 Ack=218 Win=30336 Len=1296 [TCP segment of a reassembled PDU] [TCP segment of a reassembled PDU];;;;;;;;;;;;;;;
170;4.054.572;23.7.217.88;192.168.43.47;TCP;1454;[TCP Out-Of-Order] 443  >  49728 [ACK] Seq=1401 Ack=218 Win=30336 Len=1400;;;;;;;;;;;;;;;
171;4.054.572;23.7.217.88;192.168.43.47;TLSv1.2;1454;Certificate Status [TCP segment of a reassembled PDU];;;;;;;;;;;;;;;
172;4.054.809;192.168.43.47;23.7.217.88;TCP;66;49728  >  443 [ACK] Seq=218 Ack=1401 Win=65792 Len=0 SLE=2801 SRE=4097;;;;;;;;;;;;;;;
173;4.055.027;192.168.43.47;23.7.217.88;TCP;54;49728  >  443 [ACK] Seq=218 Ack=4097 Win=65792 Len=0;;;;;;;;;;;;;;;
174;4.055.129;192.168.43.47;23.7.217.88;TCP;54;49728  >  443 [ACK] Seq=218 Ack=5497 Win=65792 Len=0;;;;;;;;;;;;;;;
175;4.123.154;23.7.217.88;192.168.43.47;TLSv1.2;336;Server Key Exchange, Server Hello Done;;;;;;;;;;;;;;;
176;4.130.619;192.168.43.47;23.7.217.88;TLSv1.2;180;Client Key Exchange, Change Cipher Spec, Encrypted Handshake Message;;;;;;;;;;;;;;;
177;4.203.317;23.7.217.88;192.168.43.47;TLSv1.2;328;New Session Ticket, Change Cipher Spec, Encrypted Handshake Message;;;;;;;;;;;;;;;
178;4.210.829;192.168.43.47;23.7.217.88;TLSv1.2;587;Application Data;;;;;;;;;;;;;;;
179;4.318.030;23.7.217.88;192.168.43.47;TLSv1.2;723;Application Data;;;;;;;;;;;;;;;
180;4.321.283;192.168.43.47;23.7.217.88;TCP;54;49728  >  443 [FIN, ACK] Seq=877 Ack=6722 Win=64512 Len=0;;;;;;;;;;;;;;;
183;4.388.867;192.168.43.47;23.7.217.88;TCP;66;49730  >  443 [SYN] Seq=0 Win=64240 Len=0 MSS=1460 WS=256 SACK_PERM=1;;;;;;;;;;;;;;;
184;4.403.104;23.7.217.88;192.168.43.47;TLSv1.2;85;Encrypted Alert;;;;;;;;;;;;;;;
185;4.403.283;192.168.43.47;23.7.217.88;TCP;54;49728  >  443 [RST, ACK] Seq=878 Ack=6753 Win=0 Len=0;;;;;;;;;;;;;;;
186;4.403.619;23.7.217.88;192.168.43.47;TCP;54;443  >  49728 [FIN, ACK] Seq=6753 Ack=878 Win=31360 Len=0;;;;;;;;;;;;;;;
187;4.465.099;23.7.217.88;192.168.43.47;TCP;66;443  >  49730 [SYN, ACK] Seq=0 Ack=1 Win=29200 Len=0 MSS=1400 SACK_PERM=1 WS=128;;;;;;;;;;;;;;;
188;4.465.317;192.168.43.47;23.7.217.88;TCP;54;49730  >  443 [ACK] Seq=1 Ack=1 Win=65792 Len=0;;;;;;;;;;;;;;;
189;4.466.358;192.168.43.47;23.7.217.88;TLSv1.2;271;Client Hello;;;;;;;;;;;;;;;
190;4.553.820;23.7.217.88;192.168.43.47;TCP;54;443  >  49730 [ACK] Seq=1 Ack=218 Win=30336 Len=0;;;;;;;;;;;;;;;
191;4.554.121;23.7.217.88;192.168.43.47;TLSv1.2;1454;Server Hello;;;;;;;;;;;;;;;
192;4.556.738;23.7.217.88;192.168.43.47;TCP;1454;443  >  49730 [ACK] Seq=1401 Ack=218 Win=30336 Len=1400 [TCP segment of a reassembled PDU];;;;;;;;;;;;;;;
193;4.556.814;192.168.43.47;23.7.217.88;TCP;54;49730  >  443 [ACK] Seq=218 Ack=2801 Win=65792 Len=0;;;;;;;;;;;;;;;
194;4.557.303;23.7.217.88;192.168.43.47;TLSv1.2;1350;Certificate [TCP segment of a reassembled PDU];;;;;;;;;;;;;;;
195;4.557.303;23.7.217.88;192.168.43.47;TLSv1.2;1454;Certificate Status [TCP segment of a reassembled PDU];;;;;;;;;;;;;;;
196;4.557.391;192.168.43.47;23.7.217.88;TCP;54;49730  >  443 [ACK] Seq=218 Ack=5497 Win=65792 Len=0;;;;;;;;;;;;;;;
197;4.623.874;23.7.217.88;192.168.43.47;TLSv1.2;336;Server Key Exchange, Server Hello Done;;;;;;;;;;;;;;;
198;4.630.805;192.168.43.47;23.7.217.88;TLSv1.2;180;Client Key Exchange, Change Cipher Spec, Encrypted Handshake Message;;;;;;;;;;;;;;;
199;4.712.859;23.7.217.88;192.168.43.47;TLSv1.2;328;New Session Ticket, Change Cipher Spec, Encrypted Handshake Message;;;;;;;;;;;;;;;
200;4.715.241;192.168.43.47;23.7.217.88;TLSv1.2;587;Application Data;;;;;;;;;;;;;;;
202;4.834.247;23.7.217.88;192.168.43.47;TCP;54;443  >  49730 [ACK] Seq=6053 Ack=877 Win=31360 Len=0;;;;;;;;;;;;;;;
203;4.958.509;23.7.217.88;192.168.43.47;TLSv1.2;319;Application Data;;;;;;;;;;;;;;;
204;4.961.051;192.168.43.47;23.7.217.88;TCP;54;49730  >  443 [FIN, ACK] Seq=877 Ack=6318 Win=64768 Len=0;;;;;;;;;;;;;;;
207;5.000.907;192.168.43.47;23.7.217.88;TCP;66;49731  >  443 [SYN] Seq=0 Win=64240 Len=0 MSS=1460 WS=256 SACK_PERM=1;;;;;;;;;;;;;;;
208;5.047.131;23.7.217.88;192.168.43.47;TLSv1.2;85;Encrypted Alert;;;;;;;;;;;;;;;
209;5.047.296;192.168.43.47;23.7.217.88;TCP;54;49730  >  443 [RST, ACK] Seq=878 Ack=6349 Win=0 Len=0;;;;;;;;;;;;;;;
210;5.047.601;23.7.217.88;192.168.43.47;TCP;54;443  >  49730 [FIN, ACK] Seq=6349 Ack=878 Win=31360 Len=0;;;;;;;;;;;;;;;
211;5.091.164;23.7.217.88;192.168.43.47;TCP;66;443  >  49731 [SYN, ACK] Seq=0 Ack=1 Win=29200 Len=0 MSS=1400 SACK_PERM=1 WS=128;;;;;;;;;;;;;;;
212;5.091.389;192.168.43.47;23.7.217.88;TCP;54;49731  >  443 [ACK] Seq=1 Ack=1 Win=65792 Len=0;;;;;;;;;;;;;;;
213;5.092.406;192.168.43.47;23.7.217.88;TLSv1.2;271;Client Hello;;;;;;;;;;;;;;;
214;5.163.181;23.7.217.88;192.168.43.47;TCP;54;443  >  49731 [ACK] Seq=1 Ack=218 Win=30336 Len=0;;;;;;;;;;;;;;;
215;5.163.923;23.7.217.88;192.168.43.47;TCP;1454;[TCP Previous segment not captured] 443  >  49731 [ACK] Seq=1401 Ack=218 Win=30336 Len=1400 [TCP segment of a reassembled PDU];;;;;;;;;;;;;;;
216;5.164.012;192.168.43.47;23.7.217.88;TCP;66;[TCP Dup ACK 212#1] 49731  >  443 [ACK] Seq=218 Ack=1 Win=65792 Len=0 SLE=1401 SRE=2801;;;;;;;;;;;;;;;
217;5.164.334;23.7.217.88;192.168.43.47;TCP;1350;443  >  49731 [PSH, ACK] Seq=2801 Ack=218 Win=30336 Len=1296 [TCP segment of a reassembled PDU] [TCP segment of a reassembled PDU];;;;;;;;;;;;;;;
218;5.164.387;192.168.43.47;23.7.217.88;TCP;66;[TCP Dup ACK 212#2] 49731  >  443 [ACK] Seq=218 Ack=1 Win=65792 Len=0 SLE=1401 SRE=4097;;;;;;;;;;;;;;;
219;5.165.410;23.7.217.88;192.168.43.47;TLSv1.2;1454;[TCP Fast Retransmission] , Server Hello;;;;;;;;;;;;;;;
220;5.165.410;23.7.217.88;192.168.43.47;TLSv1.2;1454;Ignored Unknown Record;;;;;;;;;;;;;;;
221;5.165.531;192.168.43.47;23.7.217.88;TCP;54;49731  >  443 [ACK] Seq=218 Ack=4097 Win=65792 Len=0;;;;;;;;;;;;;;;
222;5.204.916;192.168.43.47;23.7.217.88;TCP;54;49731  >  443 [ACK] Seq=218 Ack=5497 Win=65792 Len=0;;;;;;;;;;;;;;;
223;5.243.421;23.7.217.88;192.168.43.47;TLSv1.2;336;Ignored Unknown Record;;;;;;;;;;;;;;;
224;5.250.336;192.168.43.47;23.7.217.88;TLSv1.2;180;Client Key Exchange, Change Cipher Spec, Encrypted Handshake Message;;;;;;;;;;;;;;;
225;5.332.426;23.7.217.88;192.168.43.47;TLSv1.2;328;New Session Ticket, Change Cipher Spec, Encrypted Handshake Message;;;;;;;;;;;;;;;
226;5.334.988;192.168.43.47;23.7.217.88;TLSv1.2;587;Application Data;;;;;;;;;;;;;;;
227;5.341.066;147.135.46.101;192.168.43.47;TCP;54;80  >  49717 [FIN, ACK] Seq=151 Ack=1 Win=26800 Len=0;;;;;;;;;;;;;;;
228;5.341.227;192.168.43.47;147.135.46.101;TCP;54;49717  >  80 [ACK] Seq=1 Ack=152 Win=65535 Len=0;;;;;;;;;;;;;;;
229;5.424.253;23.7.217.88;192.168.43.47;TLSv1.2;746;Application Data;;;;;;;;;;;;;;;
230;5.427.213;192.168.43.47;23.7.217.88;TCP;54;49731  >  443 [FIN, ACK] Seq=877 Ack=6745 Win=64512 Len=0;;;;;;;;;;;;;;;
233;5.500.568;192.168.43.47;23.7.217.88;TCP;66;49733  >  443 [SYN] Seq=0 Win=64240 Len=0 MSS=1460 WS=256 SACK_PERM=1;;;;;;;;;;;;;;;
234;5.511.990;23.7.217.88;192.168.43.47;TCP;54;[TCP Previous segment not captured] 443  >  49731 [FIN, ACK] Seq=6776 Ack=878 Win=31360 Len=0;;;;;;;;;;;;;;;
235;5.512.141;192.168.43.47;23.7.217.88;TCP;54;[TCP Dup ACK 230#1] 49731  >  443 [ACK] Seq=878 Ack=6745 Win=64512 Len=0;;;;;;;;;;;;;;;
236;5.512.471;23.7.217.88;192.168.43.47;TCP;85;[TCP Out-Of-Order] 443  >  49731 [PSH, ACK] Seq=6745 Ack=878 Win=31360 Len=31;;;;;;;;;;;;;;;
237;5.512.557;192.168.43.47;23.7.217.88;TCP;54;49731  >  443 [RST, ACK] Seq=878 Ack=6776 Win=0 Len=0;;;;;;;;;;;;;;;
239;5.583.034;23.7.217.88;192.168.43.47;TCP;66;443  >  49733 [SYN, ACK] Seq=0 Ack=1 Win=29200 Len=0 MSS=1400 SACK_PERM=1 WS=128;;;;;;;;;;;;;;;
240;5.583.258;192.168.43.47;23.7.217.88;TCP;54;49733  >  443 [ACK] Seq=1 Ack=1 Win=65792 Len=0;;;;;;;;;;;;;;;
241;5.584.391;192.168.43.47;23.7.217.88;TLSv1.2;271;Client Hello;;;;;;;;;;;;;;;
242;5.662.229;23.7.217.88;192.168.43.47;TCP;54;443  >  49733 [ACK] Seq=1 Ack=218 Win=30336 Len=0;;;;;;;;;;;;;;;
243;5.662.966;23.7.217.88;192.168.43.47;TLSv1.2;1350;[TCP Previous segment not captured] , Ignored Unknown Record;;;;;;;;;;;;;;;
244;5.663.054;192.168.43.47;23.7.217.88;TCP;66;[TCP Dup ACK 240#1] 49733  >  443 [ACK] Seq=218 Ack=1 Win=65792 Len=0 SLE=2801 SRE=4097;;;;;;;;;;;;;;;
245;5.663.565;23.7.217.88;192.168.43.47;TCP;1454;[TCP Out-Of-Order] 443  >  49733 [ACK] Seq=1401 Ack=218 Win=30336 Len=1400;;;;;;;;;;;;;;;
246;5.663.565;23.7.217.88;192.168.43.47;TCP;1454;[TCP Out-Of-Order] 443  >  49733 [ACK] Seq=1 Ack=218 Win=30336 Len=1400;;;;;;;;;;;;;;;
247;5.663.632;192.168.43.47;23.7.217.88;TCP;66;[TCP Dup ACK 240#2] 49733  >  443 [ACK] Seq=218 Ack=1 Win=65792 Len=0 SLE=1401 SRE=4097;;;;;;;;;;;;;;;
248;5.663.773;192.168.43.47;23.7.217.88;TCP;54;49733  >  443 [ACK] Seq=218 Ack=4097 Win=65792 Len=0;;;;;;;;;;;;;;;
249;5.664.322;23.7.217.88;192.168.43.47;TLSv1.2;1454;Ignored Unknown Record;;;;;;;;;;;;;;;
250;5.704.956;192.168.43.47;23.7.217.88;TCP;54;49733  >  443 [ACK] Seq=218 Ack=5497 Win=65792 Len=0;;;;;;;;;;;;;;;
251;5.743.378;23.7.217.88;192.168.43.47;TLSv1.2;336;Ignored Unknown Record;;;;;;;;;;;;;;;
252;5.750.920;192.168.43.47;23.7.217.88;TLSv1.2;180;Client Key Exchange, Change Cipher Spec, Encrypted Handshake Message;;;;;;;;;;;;;;;
253;5.822.954;23.7.217.88;192.168.43.47;TLSv1.2;328;New Session Ticket, Change Cipher Spec, Encrypted Handshake Message;;;;;;;;;;;;;;;
254;5.825.436;192.168.43.47;23.7.217.88;TLSv1.2;587;Application Data;;;;;;;;;;;;;;;
255;5.921.979;23.7.217.88;192.168.43.47;TLSv1.2;744;Application Data;;;;;;;;;;;;;;;
256;5.925.675;192.168.43.47;23.7.217.88;TCP;54;49733  >  443 [FIN, ACK] Seq=877 Ack=6743 Win=64512 Len=0;;;;;;;;;;;;;;;
259;6.011.605;23.7.217.88;192.168.43.47;TLSv1.2;85;Encrypted Alert;;;;;;;;;;;;;;;
260;6.011.775;192.168.43.47;23.7.217.88;TCP;54;49733  >  443 [RST, ACK] Seq=878 Ack=6774 Win=0 Len=0;;;;;;;;;;;;;;;
261;6.012.092;23.7.217.88;192.168.43.47;TCP;54;443  >  49733 [FIN, ACK] Seq=6774 Ack=878 Win=31360 Len=0;;;;;;;;;;;;;;;
262;6.012.456;192.168.43.47;23.7.217.88;TCP;66;49734  >  443 [SYN] Seq=0 Win=64240 Len=0 MSS=1460 WS=256 SACK_PERM=1;;;;;;;;;;;;;;;
263;6.097.466;23.7.217.88;192.168.43.47;TCP;66;443  >  49734 [SYN, ACK] Seq=0 Ack=1 Win=29200 Len=0 MSS=1400 SACK_PERM=1 WS=128;;;;;;;;;;;;;;;
264;6.097.689;192.168.43.47;23.7.217.88;TCP;54;49734  >  443 [ACK] Seq=1 Ack=1 Win=65792 Len=0;;;;;;;;;;;;;;;
265;6.098.690;192.168.43.47;23.7.217.88;TLSv1.2;271;Client Hello;;;;;;;;;;;;;;;
266;6.176.201;23.7.217.88;192.168.43.47;TCP;54;443  >  49734 [ACK] Seq=1 Ack=218 Win=30336 Len=0;;;;;;;;;;;;;;;
267;6.176.893;23.7.217.88;192.168.43.47;TLSv1.2;1350;[TCP Previous segment not captured] , Ignored Unknown Record;;;;;;;;;;;;;;;
268;6.176.893;23.7.217.88;192.168.43.47;TCP;1454;[TCP Out-Of-Order] 443  >  49734 [ACK] Seq=1401 Ack=218 Win=30336 Len=1400;;;;;;;;;;;;;;;
269;6.176.893;23.7.217.88;192.168.43.47;TCP;1454;[TCP Out-Of-Order] 443  >  49734 [ACK] Seq=1 Ack=218 Win=30336 Len=1400;;;;;;;;;;;;;;;
270;6.177.002;192.168.43.47;23.7.217.88;TCP;66;[TCP Dup ACK 264#1] 49734  >  443 [ACK] Seq=218 Ack=1 Win=65792 Len=0 SLE=2801 SRE=4097;;;;;;;;;;;;;;;
271;6.177.178;192.168.43.47;23.7.217.88;TCP;66;[TCP Dup ACK 264#2] 49734  >  443 [ACK] Seq=218 Ack=1 Win=65792 Len=0 SLE=1401 SRE=4097;;;;;;;;;;;;;;;
272;6.177.306;192.168.43.47;23.7.217.88;TCP;54;49734  >  443 [ACK] Seq=218 Ack=4097 Win=65792 Len=0;;;;;;;;;;;;;;;
273;6.177.492;23.7.217.88;192.168.43.47;TLSv1.2;1454;Ignored Unknown Record;;;;;;;;;;;;;;;
274;6.217.879;192.168.43.47;23.7.217.88;TCP;54;49734  >  443 [ACK] Seq=218 Ack=5497 Win=65792 Len=0;;;;;;;;;;;;;;;
275;6.247.161;23.7.217.88;192.168.43.47;TLSv1.2;336;Ignored Unknown Record;;;;;;;;;;;;;;;
276;6.253.948;192.168.43.47;23.7.217.88;TLSv1.2;180;Client Key Exchange, Change Cipher Spec, Encrypted Handshake Message;;;;;;;;;;;;;;;
278;6.328.268;23.7.217.88;192.168.43.47;TLSv1.2;328;New Session Ticket, Change Cipher Spec, Encrypted Handshake Message;;;;;;;;;;;;;;;
279;6.330.777;192.168.43.47;23.7.217.88;TLSv1.2;587;Application Data;;;;;;;;;;;;;;;
280;6.436.095;23.7.217.88;192.168.43.47;TLSv1.2;741;Application Data;;;;;;;;;;;;;;;
281;6.438.843;192.168.43.47;23.7.217.88;TCP;54;49734  >  443 [FIN, ACK] Seq=877 Ack=6740 Win=64512 Len=0;;;;;;;;;;;;;;;
284;6.478.994;192.168.43.47;23.7.217.88;TCP;66;49736  >  443 [SYN] Seq=0 Win=64240 Len=0 MSS=1460 WS=256 SACK_PERM=1;;;;;;;;;;;;;;;
285;6.518.232;23.7.217.88;192.168.43.47;TLSv1.2;85;Encrypted Alert;;;;;;;;;;;;;;;
286;6.518.373;192.168.43.47;23.7.217.88;TCP;54;49734  >  443 [RST, ACK] Seq=878 Ack=6771 Win=0 Len=0;;;;;;;;;;;;;;;
287;6.518.617;23.7.217.88;192.168.43.47;TCP;54;443  >  49734 [FIN, ACK] Seq=6771 Ack=878 Win=31360 Len=0;;;;;;;;;;;;;;;
288;6.567.430;23.7.217.88;192.168.43.47;TCP;66;443  >  49736 [SYN, ACK] Seq=0 Ack=1 Win=29200 Len=0 MSS=1400 SACK_PERM=1 WS=128;;;;;;;;;;;;;;;
289;6.567.624;192.168.43.47;23.7.217.88;TCP;54;49736  >  443 [ACK] Seq=1 Ack=1 Win=65792 Len=0;;;;;;;;;;;;;;;
290;6.568.445;192.168.43.47;23.7.217.88;TLSv1.2;271;Client Hello;;;;;;;;;;;;;;;
291;6.647.567;23.7.217.88;192.168.43.47;TCP;54;443  >  49736 [ACK] Seq=1 Ack=218 Win=30336 Len=0;;;;;;;;;;;;;;;
292;6.648.696;23.7.217.88;192.168.43.47;TCP;1454;[TCP Previous segment not captured] 443  >  49736 [ACK] Seq=1401 Ack=218 Win=30336 Len=1400;;;;;;;;;;;;;;;
293;6.648.774;192.168.43.47;23.7.217.88;TCP;66;[TCP Dup ACK 289#1] 49736  >  443 [ACK] Seq=218 Ack=1 Win=65792 Len=0 SLE=1401 SRE=2801;;;;;;;;;;;;;;;
294;6.649.248;23.7.217.88;192.168.43.47;TLSv1.2;1350;Ignored Unknown Record;;;;;;;;;;;;;;;
295;6.649.248;23.7.217.88;192.168.43.47;TCP;1454;[TCP Out-Of-Order] 443  >  49736 [ACK] Seq=1 Ack=218 Win=30336 Len=1400;;;;;;;;;;;;;;;
296;6.649.292;192.168.43.47;23.7.217.88;TCP;66;[TCP Dup ACK 289#2] 49736  >  443 [ACK] Seq=218 Ack=1 Win=65792 Len=0 SLE=1401 SRE=4097;;;;;;;;;;;;;;;
297;6.649.384;192.168.43.47;23.7.217.88;TCP;54;49736  >  443 [ACK] Seq=218 Ack=4097 Win=65792 Len=0;;;;;;;;;;;;;;;
298;6.649.921;23.7.217.88;192.168.43.47;TLSv1.2;1454;Ignored Unknown Record;;;;;;;;;;;;;;;
299;6.690.817;192.168.43.47;23.7.217.88;TCP;54;49736  >  443 [ACK] Seq=218 Ack=5497 Win=65792 Len=0;;;;;;;;;;;;;;;
300;6.730.007;23.7.217.88;192.168.43.47;TLSv1.2;336;Ignored Unknown Record;;;;;;;;;;;;;;;
301;6.734.834;192.168.43.47;23.7.217.88;TLSv1.2;180;Client Key Exchange, Change Cipher Spec, Encrypted Handshake Message;;;;;;;;;;;;;;;
302;6.807.045;23.7.217.88;192.168.43.47;TLSv1.2;328;New Session Ticket, Change Cipher Spec, Encrypted Handshake Message;;;;;;;;;;;;;;;
303;6.808.946;192.168.43.47;23.7.217.88;TLSv1.2;587;Application Data;;;;;;;;;;;;;;;
304;6.936.817;23.7.217.88;192.168.43.47;TCP;54;443  >  49736 [ACK] Seq=6053 Ack=877 Win=31360 Len=0;;;;;;;;;;;;;;;
305;7.058.769;23.7.217.88;192.168.43.47;TLSv1.2;319;Application Data;;;;;;;;;;;;;;;
306;7.060.669;192.168.43.47;23.7.217.88;TCP;54;49736  >  443 [FIN, ACK] Seq=877 Ack=6318 Win=64768 Len=0;;;;;;;;;;;;;;;
309;7.089.459;192.168.43.47;23.7.217.88;TCP;66;49737  >  443 [SYN] Seq=0 Win=64240 Len=0 MSS=1460 WS=256 SACK_PERM=1;;;;;;;;;;;;;;;
310;7.154.847;23.7.217.88;192.168.43.47;TCP;54;[TCP Previous segment not captured] 443  >  49736 [FIN, ACK] Seq=6349 Ack=878 Win=31360 Len=0;;;;;;;;;;;;;;;
311;7.154.979;192.168.43.47;23.7.217.88;TCP;54;[TCP Dup ACK 306#1] 49736  >  443 [ACK] Seq=878 Ack=6318 Win=64768 Len=0;;;;;;;;;;;;;;;
312;7.155.220;23.7.217.88;192.168.43.47;TCP;85;[TCP Out-Of-Order] 443  >  49736 [PSH, ACK] Seq=6318 Ack=878 Win=31360 Len=31;;;;;;;;;;;;;;;
313;7.155.277;192.168.43.47;23.7.217.88;TCP;54;49736  >  443 [RST, ACK] Seq=878 Ack=6349 Win=0 Len=0;;;;;;;;;;;;;;;
314;7.175.730;23.7.217.88;192.168.43.47;TCP;66;443  >  49737 [SYN, ACK] Seq=0 Ack=1 Win=29200 Len=0 MSS=1400 SACK_PERM=1 WS=128;;;;;;;;;;;;;;;
315;7.175.906;192.168.43.47;23.7.217.88;TCP;54;49737  >  443 [ACK] Seq=1 Ack=1 Win=65792 Len=0;;;;;;;;;;;;;;;
316;7.176.689;192.168.43.47;23.7.217.88;TLSv1.2;271;Client Hello;;;;;;;;;;;;;;;
317;7.255.762;148.72.212.69;192.168.43.47;TCP;54;80  >  49705 [FIN, ACK] Seq=1 Ack=1 Win=229 Len=0;;;;;;;;;;;;;;;
318;7.255.886;192.168.43.47;148.72.212.69;TCP;54;49705  >  80 [ACK] Seq=1 Ack=2 Win=1021 Len=0;;;;;;;;;;;;;;;
319;7.283.743;23.7.217.88;192.168.43.47;TCP;54;443  >  49737 [ACK] Seq=1 Ack=218 Win=30336 Len=0;;;;;;;;;;;;;;;
320;7.284.471;23.7.217.88;192.168.43.47;TCP;1454;[TCP Previous segment not captured] 443  >  49737 [ACK] Seq=1401 Ack=218 Win=30336 Len=1400;;;;;;;;;;;;;;;
321;7.284.471;23.7.217.88;192.168.43.47;TLSv1.2;1350;Ignored Unknown Record;;;;;;;;;;;;;;;
322;7.284.471;23.7.217.88;192.168.43.47;TCP;1454;[TCP Out-Of-Order] 443  >  49737 [ACK] Seq=1 Ack=218 Win=30336 Len=1400;;;;;;;;;;;;;;;
323;7.284.554;192.168.43.47;23.7.217.88;TCP;66;[TCP Dup ACK 315#1] 49737  >  443 [ACK] Seq=218 Ack=1 Win=65792 Len=0 SLE=1401 SRE=2801;;;;;;;;;;;;;;;
324;7.284.701;192.168.43.47;23.7.217.88;TCP;66;[TCP Dup ACK 315#2] 49737  >  443 [ACK] Seq=218 Ack=1 Win=65792 Len=0 SLE=1401 SRE=4097;;;;;;;;;;;;;;;
325;7.284.789;192.168.43.47;23.7.217.88;TCP;54;49737  >  443 [ACK] Seq=218 Ack=4097 Win=65792 Len=0;;;;;;;;;;;;;;;
326;7.284.927;23.7.217.88;192.168.43.47;TLSv1.2;1454;Ignored Unknown Record;;;;;;;;;;;;;;;
327;7.331.832;192.168.43.47;23.7.217.88;TCP;54;49737  >  443 [ACK] Seq=218 Ack=5497 Win=65792 Len=0;;;;;;;;;;;;;;;
328;7.365.674;23.7.217.88;192.168.43.47;TCP;336;[TCP segment of a reassembled PDU];;;;;;;;;;;;;;;
329;7.370.870;192.168.43.47;23.7.217.88;TLSv1.2;180;Client Key Exchange, Change Cipher Spec, Encrypted Handshake Message;;;;;;;;;;;;;;;
330;7.463.674;23.7.217.88;192.168.43.47;TLSv1.2;328;New Session Ticket, Change Cipher Spec, Encrypted Handshake Message;;;;;;;;;;;;;;;
331;7.465.451;192.168.43.47;23.7.217.88;TLSv1.2;587;Application Data;;;;;;;;;;;;;;;
332;7.602.883;23.7.217.88;192.168.43.47;TCP;54;443  >  49737 [ACK] Seq=6053 Ack=877 Win=31360 Len=0;;;;;;;;;;;;;;;
333;7.726.893;23.7.217.88;192.168.43.47;TLSv1.2;725;Application Data;;;;;;;;;;;;;;;
334;7.729.452;192.168.43.47;23.7.217.88;TCP;54;49737  >  443 [FIN, ACK] Seq=877 Ack=6724 Win=64512 Len=0;;;;;;;;;;;;;;;
337;7.815.761;23.7.217.88;192.168.43.47;TCP;54;[TCP Previous segment not captured] 443  >  49737 [FIN, ACK] Seq=6755 Ack=878 Win=31360 Len=0;;;;;;;;;;;;;;;
338;7.815.882;192.168.43.47;23.7.217.88;TCP;54;[TCP Dup ACK 334#1] 49737  >  443 [ACK] Seq=878 Ack=6724 Win=64512 Len=0;;;;;;;;;;;;;;;
339;7.816.134;23.7.217.88;192.168.43.47;TCP;85;[TCP Out-Of-Order] 443  >  49737 [PSH, ACK] Seq=6724 Ack=878 Win=31360 Len=31;;;;;;;;;;;;;;;
340;7.816.193;192.168.43.47;23.7.217.88;TCP;54;49737  >  443 [RST, ACK] Seq=878 Ack=6755 Win=0 Len=0;;;;;;;;;;;;;;;
341;7.820.351;192.168.43.47;23.7.217.88;TCP;66;49738  >  443 [SYN] Seq=0 Win=64240 Len=0 MSS=1460 WS=256 SACK_PERM=1;;;;;;;;;;;;;;;
342;7.905.962;23.7.217.88;192.168.43.47;TCP;66;443  >  49738 [SYN, ACK] Seq=0 Ack=1 Win=29200 Len=0 MSS=1400 SACK_PERM=1 WS=128;;;;;;;;;;;;;;;
343;7.906.144;192.168.43.47;23.7.217.88;TCP;54;49738  >  443 [ACK] Seq=1 Ack=1 Win=65792 Len=0;;;;;;;;;;;;;;;
344;7.906.973;192.168.43.47;23.7.217.88;TLSv1.2;271;Client Hello;;;;;;;;;;;;;;;
345;8.003.590;23.7.217.88;192.168.43.47;TCP;54;443  >  49738 [ACK] Seq=1 Ack=218 Win=30336 Len=0;;;;;;;;;;;;;;;
346;8.005.643;23.7.217.88;192.168.43.47;TLSv1.2;1454;Server Hello;;;;;;;;;;;;;;;
347;8.006.016;23.7.217.88;192.168.43.47;TCP;1454;443  >  49738 [ACK] Seq=1401 Ack=218 Win=30336 Len=1400 [TCP segment of a reassembled PDU];;;;;;;;;;;;;;;
348;8.006.071;192.168.43.47;23.7.217.88;TCP;54;49738  >  443 [ACK] Seq=218 Ack=2801 Win=65792 Len=0;;;;;;;;;;;;;;;
349;8.006.867;23.7.217.88;192.168.43.47;TLSv1.2;1350;Certificate [TCP segment of a reassembled PDU];;;;;;;;;;;;;;;
350;8.006.867;23.7.217.88;192.168.43.47;TLSv1.2;1454;Certificate Status [TCP segment of a reassembled PDU];;;;;;;;;;;;;;;
351;8.006.973;192.168.43.47;23.7.217.88;TCP;54;49738  >  443 [ACK] Seq=218 Ack=5497 Win=65792 Len=0;;;;;;;;;;;;;;;
352;8.109.690;23.7.217.88;192.168.43.47;TLSv1.2;336;Server Key Exchange, Server Hello Done;;;;;;;;;;;;;;;
353;8.114.414;192.168.43.47;23.7.217.88;TLSv1.2;180;Client Key Exchange, Change Cipher Spec, Encrypted Handshake Message;;;;;;;;;;;;;;;
354;8.203.696;23.7.217.88;192.168.43.47;TLSv1.2;328;New Session Ticket, Change Cipher Spec, Encrypted Handshake Message;;;;;;;;;;;;;;;
355;8.206.600;192.168.43.47;23.7.217.88;TLSv1.2;587;Application Data;;;;;;;;;;;;;;;
356;8.324.051;23.7.217.88;192.168.43.47;TLSv1.2;726;Application Data;;;;;;;;;;;;;;;
357;8.326.508;192.168.43.47;23.7.217.88;TCP;54;49738  >  443 [FIN, ACK] Seq=877 Ack=6725 Win=64512 Len=0;;;;;;;;;;;;;;;
360;8.399.440;192.168.43.47;23.7.217.88;TCP;66;49739  >  443 [SYN] Seq=0 Win=64240 Len=0 MSS=1460 WS=256 SACK_PERM=1;;;;;;;;;;;;;;;
361;8.407.740;23.7.217.88;192.168.43.47;TLSv1.2;85;Encrypted Alert;;;;;;;;;;;;;;;
